<xs:schema xmlns:xs="http://www.w3.org/2001/XMLSchema">
  <xs:element name="bookstore">
    <xs:complexType>
      <xs:sequence>
        <xs:element name="detail" maxOccurs="unbounded">
          <xs:complexType>
            <xs:sequence>
              <xs:element name="title" type="xs:string"/>
              <xs:element name="author" type="xs:string"/>
              <xs:element name="price" type="xs:integer"/>
              <xs:element name="genre" type="xs:string"/>
            </xs:sequence>
          </xs:complexType>
        </xs:element>
        </xs:sequence>
    </xs:complexType>
  </xs:element>
</xs:schema>